Title,Time,Publisher,Role,Descriptions
"How feminism, not Bollywood, drew global audiences to Indian cinema in 2024",15 hours ago,Yasser Usman,Film writer,"['In 2024, as Bollywood struggled to find its footing, smaller films by Indian women that told nuanced stories made headlines in the country and across the world.In May, Indian filmmaker Payal Kapadia\'s All We Imagine As Light made history by winning the Grand Prix at the Cannes film festival.In the months since then, All We Imagine As Light has become a juggernaut of indie cinema, sweeping through film festivals and the awards circuit. It has been judged the Best International film by prestigious associations including the New York Film Critics Circle and the Toronto Film Critics Association. It has also picked up two Golden Globe nominations, including for Ms Kapadia as best director. It is also on several best films of the year list, including that of the BBC and the New York Times.And it has company. Director Shuchi Talati\'s coming-of-age drama Girls Will Be Girls won two awards at the Sundance Film Festival. Kiran Rao\'s Laapataa Ladies (Lost Ladies) spent at least two months on the top 10 list of Netflix in India and was picked as the country\'s official Oscar entry (a controversial decision). Laapataa Ladies didn\'t make it to the Academy\'s shortlist. What did make it was British-Indian director Sandhya Suri\'s Hindi film Santosh, which had been picked as the UK\'s submission to the Oscars.Is this sudden wave of success for Indian films an aberration or a long-awaited shift in global consciousness? ""It\'s a culmination of both,"" says film critic Shubhra Gupta, pointing out that these films were not ""made overnight"".For instance, Shuchi Talati, the director of Girls Will Be Girls, and its co-producer Richa Chadha were in college together when they first came up with the idea for the film. ""They have been working on it for years,"" Gupta says. ""It\'s pure serendipity that 2024 became the year these films were released, igniting conversations together.""', 'This fortunate alignment has been a cinematic dream. The global impact of these films is rooted in their quality and exploration of universal themes like loneliness, relationships, identity, gender and resilience. With strong female voices and unconventional feminist narratives, these stories venture into territories unexplored by mainstream Indian cinema.In All We Imagine As Light, a film made in the Hindi, Marathi and Malayalam languages, three migrant women in Mumbai navigate empathy, resilience and human connection. The narrative delves into themes of loneliness and the socio-political landscape, notably the scrutiny of interfaith Hindu-Muslim relationships as seen with the character Anu (Divya Prabha) and her bond with Shiaz (Hridhu Haroon).Kapadia told the BBC that while the women in her films are financially independent, they still face limitations in their personal lives, particularly when it comes to matters of love. ""For me, love in India is very political… women seem to hold a lot of the so-called honour of the family and the protection of the caste lineage. So if she marries somebody who is of a different religion or of a different caste, that becomes an issue. For me, it is really a method to control women and infantilise them,"" she says.Talati\'s Girls Will Be Girls explores female adolescence, rebellion and intergenerational conflict through the story of a 16-year-old girl studying at a strict boarding school in the Himalayas and her fractured relationship with her mother, Anila, who struggles with her own vulnerabilities and unresolved emotions.""It is the kind of coming-of-age film that we don\'t do in India at all,"" Gupta says. ""It looks at women from a very empathetic, very warm gaze.""""The age where people experience emotions with and without their bodies, their minds, that exploration but without infantilising the experience - it was never part of Indian mainstream cinema,"" she adds.', 'Kiran Rao\'s Laapataa Ladies did not perform well at the box-office but got warm reviews from viewers and critics. At a BAFTA screening in London this month, Ms Rao described the current moment as ""really special for women from India"", expressing hope for a continued wave of such stories. Her film is a satirical comedy about two newlywed brides getting accidentally swapped on a train because of their veils. It offers a sharp commentary on patriarchy, identity and gender roles, a shift from decades of male-centred mainstream Indian films.""A lot of us who are very patriarchal in our thinking are often that way because that\'s how we have been brought up,"" Bollywood star Aamir Khan, a co-producer of the film, said after the screening. ""But we need to be understanding, at least try and help each other even to come out of this kind of thinking.""The biggest surprise this year came from the UK, which selected the Hindi-language film Santosh, directed by British-Indian filmmaker Sandhya Suri, as its Oscar entry. Shot entirely in India over a 44-day schedule, it featured a largely female crew. Starring Indian actors Shahana Goswami and Sunita Rajbhar, Santosh was co-produced by people and companies across the UK, India, Germany and France.The film is intrinsically an Indian story about violence against women, set as a taut thriller.Goswami says the success of Santosh and All We Imagine as Light points to the merging of borders and expansion of film industries, creating space for cross-pollination and exchange. ""We often think these Indian films require [specific] cultural context, but they don\'t. Any film driven by emotion will resonate universally, regardless of its origins,"" she told the BBC.', 'Three of the films - All We Imagine as Light, Girls Will Be Girls and Santosh - share one more common trait: they are cross-country co-productions. Goswami agrees that this could this be a formula for the future. ""With a French producer, for example, a film gains the opportunity to be seen by a French audience who may follow that producer or the broader film industry. This is how it becomes more globally accessible and relevant,"" she says.Even in Bollywood, some women-led films have had huge success this year. Stree 2, a horror-comedy about a mysterious woman battling a monster who abducts free-thinking women, was the year\'s second-biggest hit, playing in cinemas for months. On streaming platforms, Sanjay Leela Bhansali\'s opulent Netflix series Heeramandi: The Diamond Bazaar, an exploration of the misogyny and exploitation in the lives of courtesans in pre-independent India, was among Google\'s top-searched TV shows of the year. Their success seems to signal a growing appetite for such stories, their broad appeal demonstrating that mainstream cinema can address important themes without sacrificing entertainment value.Despite systemic challenges, 2024 has highlighted the global power of female voices from India and the demand for diverse stories. The momentum could be crucial for the Indian film industry in getting wider distribution for its independent films and pave the way for a more diverse and equitable film landscape.']"
"New elections could take up to four years, Syria rebel leader says",,BBC News,Member of BBC News. Name not available,"['Holding new elections in Syria could take up to four years, rebel leader Ahmed al-Sharaa has said in a broadcast interview.This is the first time he has given a timeline for possible elections in Syria since his group Hayat Tahrir al-Sham (HTS) led a rebel offensive that ousted former President Bashar al-Assad.In the interview with Saudi state broadcaster Al Arabiya on Sunday, he said drafting a new constitution could take up to three years.He said it could also be a year before Syrians begin to see significant change and improvements to public services following the overthrow of the Assad regime.', 'Sharaa said Syria needed to rebuild its legal system and would have to hold a comprehensive population census to run legitimate elections.Sharaa - previously known as Abu Mohammed al-Jolani - has led the country\'s new  authorities after the Assad presidency fell earlier this month.Since then, questions have been raised over how HTS will govern the multi-ethnic country.HTS began as a jihadist group - espousing violence to achieve its goal of establishing a state governed by Islamic law (Sharia) - but has distanced itself from that past in recent years. Sharaa said the group, which was once aligned with Islamic State and al- Qaeda and is designated as a terrorist organisation by the UN and many countries, will be ""dissolved"" at an upcoming national dialogue conference but gave no further details.The gathering could be the first test of whether Syria\'s new leadership can achieve the promised goal of uniting the country after thirteen years of civil war.Responding to criticism of his transitional government, he said the appointments made were ""essential"" and not meant to exclude anyone.Syria is home to many ethnic and religious groups, including Kurds, Armenians, Assyrians, Christians, Druze, Alawite Shia and Arab Sunnis, the last of whom make up a majority of the Muslim population.His group have promised to protect the rights and freedoms of minorities in the country.', 'Meanwhile, nearly 300 people have been arrested in the past week in a crackdown on Assad loyalists, according to a UK-based war monitor.Those arrested include informants, pro-regime fighters and former soldiers, Syrian Observatory for Human Rights head Rami Abdel Rahman said.He told AFP news agency the arrests had been taking place ""with the cooperation of local populations"".Syrian state news agency Sana also reported arrests this week targeting ""Assad militia members"" where weapons and ammunition were seized.']"
"As Putin reaches 25 years in power, has he 'taken care of Russia'?",,BBC News,Member of BBC News. Name not available,"['I will never forget New Year\'s Eve 1999.I was working as a producer in the BBC\'s Moscow bureau. Suddenly there was breaking news: Russia\'s President Boris Yeltsin had stepped down.His decision to resign took everyone by surprise, including the British press corps in Moscow. When the news broke there was no correspondent in the office. That meant I had to step in to write and broadcast my first BBC dispatch.""Boris Yeltsin always said he would see out his full term in office,"" I wrote. ""Today he told Russians he\'d changed his mind.""It was the start of my career as a reporter.And the start of Vladimir Putin\'s as Russia\'s leader.Following Yeltsin\'s resignation, in accordance with the Russian constitution, Prime Minister Putin became acting president. Three months later he won the election.On leaving the Kremlin, Yeltsin\'s parting instruction to Putin was: ""Take care of Russia!""', 'I\'ve found myself recalling these words of Yeltsin more and more, the closer Russia\'s war on Ukraine gets to the three-year mark.That\'s because President Putin\'s full-scale invasion of Ukraine has had devastating consequences.Primarily for Ukraine, which has seen massive destruction and casualties in its cities. Almost 20% of its territory has been occupied and 10 million of its citizens have been displaced.But for Russia, too:Since Vladimir Putin\'s decision to launch his so-called ""special military operation"" Russia has sustained heavy losses on the battlefieldRussian towns and cities come under regular drone attackUkrainian soldiers have occupied a part of Russia\'s Kursk regionInternational sanctions are heaping pressure on Russia\'s economyWhat\'s more, the country\'s demographic situation is direDomestic repression has picked up apaceI\'ve been reporting on Putin since he came to power a quarter of a century ago.On 31 December 1999, who would have thought that Russia\'s new leader would still be in power two and a half decades later? Or that Russia today would be waging war on Ukraine and facing off with the West?', 'I often wonder whether the course of history would have been drastically different if Yeltsin had picked someone else to succeed him. The question, of course, is academic. History is full of ifs and buts and maybes.One thing I can say with certainty: over twenty-five years I\'ve seen different Putins.And I\'m not the only one.""The Putin I met with, did good business with, established a Nato-Russia Council with, is very, very different from this almost megalomaniac at the present moment,"" former Nato chief Lord Robertson told me in 2023.""The man who stood beside me in May 2002, right beside me, and said Ukraine is a sovereign and independent nation state which will make its own decisions about security, is now the man who says that [Ukraine] is not a nation state.""I think that Vladimir Putin has a very thin skin and a huge ambition for his country. The Soviet Union was recognised as the second superpower in the world. Russia can\'t make any claims in that direction. And I think that ate away at his ego.""That is one possible explanation for the change we\'ve seen in Putin: his burning ambition to ""Make Russia Great Again"" (and to make up for what many perceive as Moscow\'s defeat in the Cold War) put Russia on an inevitable collision course with its neighbours – and with the West.The Kremlin has a different explanation. From the speeches he gives, the comments he makes, Putin appears driven by resentment, by an all-encompassing feeling that for years Russia has been lied to and disrespected, its security concerns dismissed by the West.But does Putin himself believe that he has fulfilled Yeltsin\'s request to ""take care of Russia?""I recently had a chance to find out.', 'More than four hours into his lengthy end-of-year press conference, Putin invited me to ask a question.""Boris Yeltsin told you to take care of Russia,"" I reminded the president. ""But what of the significant losses in your so-called \'special military operation\', the Ukrainian troops in Kursk region, the sanctions, the high inflation. Do you think you\'ve taken care of your country?""""Yes,"" President Putin replied. ""And I haven\'t just taken care of it. We\'ve pulled back from the edge of the abyss.""He portrayed Yeltsin\'s Russia as a country that had been losing its sovereignty. He accused the West of having ""patronisingly patted"" Yeltsin on the shoulder while ""using Russia for its own purposes"". But he, Putin, was ""doing everything"", he said, ""to ensure Russia was an independent sovereign state"".Presenting himself as the defender of Russian sovereignty: is this a view he\'s come up with retrospectively to try to justify the war in Ukraine? Or does Putin really believe this take on modern Russian history?I\'m still not sure. Not yet. But I sense that it is a key question.The answer to it may well influence how the war ends - and Russia\'s future direction.']"
Did bird strike contribute to South Korea plane crash? What we know so far,2 hours ago,BBC News,Member of BBC News. Name not available,"['More than 170 people have died after a plane crashed as it was landing in South Korea on Sunday morning.The Jeju Air plane came off the runway before colliding with a wall at Muan International Airport in the south west of the country.The plane, which was returning from Bangkok, in Thailand, was carrying 181 people - 179 of whom have died, while two crew members were rescued from the wreckage.Authorities are investigating the cause of the crash, which fire officials have indicated may have occurred due to a bird strike and bad weather. However experts have warned the crash could have been caused by a number of factors.', 'The flight, 7C2216, was a Boeing 737-800 operated by Jeju Air, Korea\'s most popular budget airline.The plane arrived in Muan at about 09:00 local time (00:00 GMT).A South Korean transport official said that the plane had been attempting to land but was forced to hold off after air traffic control gave a bird strike warning - an alert about the risk of a collision with birds. About two minutes later, the pilot called in a Mayday and air traffic command gave permission for the plane to land from the opposite direction, the official said.One passenger on the flight messaged a relative, saying that a bird ""was stuck in the wing"" and that the plane could not land, local media reported.One video appears to show the plane touching down without using its wheels or any other landing gear. It skidded down the runway and crashed into a wall before erupting into flames.A witness told the South Korean news agency Yonhap that they heard a ""loud bang"" followed by a ""series of explosions"".Videos from the scene show the plane ablaze with smoke billowing into the sky. Fire crews have since extinguished the fire. Lee Jeong-hyun, the chief of the Muan fire department, told a televised briefing that the tail section of the plane was identifiable but ""one cannot recognise the shape of the rest of the plane"".He said that the bird strike and bad weather may have caused the crash - but that the exact cause is still being investigated. The flight and voice recorders from the plane have been recovered.The head of Jeju Air\'s management said that the crash was not due to ""any maintenance issues"", the Yonhap news agency reported.The South Korean transport department said that the head pilot on the flight had held the role since 2019 and had more than 6,800 hours of flight experience.', ""A bird strike is a collision between a plane in flight and a bird. They are very common - in the UK, there were more than 1,400 bird strikes reported in 2022, only about 100 of which affected the plane, according to data from the Civil Aviation Authority.The best known bird strike occurred in 2009, when an Airbus plane ditched into New York's Hudson River after colliding with a flock of geese. All 155 passengers and crew survived.Professor Doug Drury, who teaches aviation at CQUniversity Australia, wrote in an article for The Conversation this summer that Boeing planes have turbofan engines, which can be severely damaged in a bird strike. He said that pilots are trained to be especially vigilant during the early morning or at sunset, when birds are most active."", ""The plane was carrying 175 passengers and six crew. Two of the passengers were Thai and the rest are believed to have been South Korean, authorities have said. Many are thought to have been returning from a Christmas holiday in Thailand.The official death toll stands at 179 - making it the deadliest plane crash in South Korean history. All the passengers and four members of crew died.Authorities have so far identified at least 88 bodies.Five of the people who died were children under the age of 10. The youngest passenger was a three-year-old boy and the oldest was 78, authorities said, citing the passenger manifest.South Korea's National Fire Agency said two members of flight crew - a man and a woman - survived the crash. They were found in the tail side of the aircraft after the crash and taken to hospital, it said.More than 1,500 emergency personnel have been deployed as part of recovery efforts, including 490 fire employees and 455 police officers. They have been searching the area around the runway for parts of the plane and those who were onboard."", 'Acting President Choi Sang-mok has declared a special disaster zone in Muan, which makes central government funding available to the local government and victims.All flights to and from Muan International Airport have been cancelled.Families of the victims of the crash have been travelling to the airport in the hope of finding out what happened to their relatives. Video footage from Reuters shows officials reading names of the victims out loud.', 'Airport authorities and the Red Cross have set up more than a dozen tents in the airport for bereaved families to grieve in private. Sounds of crying echoed through the terminal. Some are frustrated at how long it is taking to identify the bodies.Jeju Air has apologised to families. Its chief executive said in a news conference that the airline had no history of accidents. It is believed that Sunday\'s crash has been the only fatal accident since the airline was launched in 2005.Plane manufacturer Boeing has offered condolences to those affected.Choi, South Korea\'s acting president, said: ""I express my deepest condolences to the many victims in the incident. I will do all I can for the injured to quickly recover.""The government has declared a period of national mourning for the country for the next seven days, during which flags at government offices will be lowered.']"
