Title,Time,Publisher,Role,Descriptions
Billionaire HBO creator Charles Dolan dies aged 98,1 hour ago,Lisa Lambert,"BBC News, Washington","['At the time, he was selling special programming to hotels through his Teleguide service, while cable television was taking off in rural areas.In 1964 Dolan made a deal with New York to wire some Manhattan buildings with cable and a few years later, hoping to attract viewers, he made a deal to show the Knicks and Rangers play-offs on cable, according to Variety.He then went on to create Home Box Office for movies, and then sold both his cable service and HBO to build up Cablevision, which ended up providing television and  internet to households across the north-eastern United States.In 2015, the Dolan family sold Cablevision to European company Altice for nearly $18bn (£14.3bn).By then Dolan\'s son James was running what the New York Times called the family\'s empire.And the Dolans had become ""the family that New Yorkers often loved to hate"", according to the New York Times, over frustration over the Knicks\' performance and fights with networks over their programming that had threatened to keep customers from watching the Academy Awards and the World Series.Dolan was worth $5.4bn (£4.3bn) at the time of his death, according to Forbes.']"
School chaplain killed in shark attack on Australia's Great Barrier Reef,,BBC News,Member of BBC News. Name not available,"['A 40-year-old man has died after being attacked by a shark on the edge of Australia\'s Great Barrier Reef, local police said.Luke Walford, a youth pastor, had been spearfishing with his family when he was bitten on Saturday afternoon.He sustained ""life-threatening injuries"" and despite paramedics\' efforts, he died at the scene about an hour later, authorities said.He and his family had been in the water at Humpy Island, in the Great Barrier Reef\'s Keppel Bay Islands National Park, when the attack happened. The area is a popular spot for diving and snorkelling.', 'Walford had been a school chaplain and pastor at the Cathedral of Praise church in Rockhampton, Queensland.Donna Kirkland, his local MP, said she was in shock, and that Walford was a friend to her and ""countless others.""""My prayers and heartfelt condolences are with his beautiful family and indeed the many who will be devastated, as I am, at this news"", she added.A family friend told ABC News he had watched the rescue helicopter fly over his house, unaware it was for his friend.""I always say a little tribute for whoever it may be, but to find out it was Luke was a very sad day,"" Doug Webber said.Queensland police said a report would be prepared for the coroner.Australia\'s last fatal shark attack happened in December 2023, when a teenage boy was killed in the south.Just this year, there have been four other shark incidents in Australia, according to a local database.In general, Australia sees more shark attacks than any other country except the US.']"
Did bird strike contribute to South Korea plane crash? What we know so far,,BBC News,Member of BBC News. Name not available,"['More than 170 people have died after a plane crashed as it was landing in South Korea on Sunday morning.The Jeju Air plane came off the runway before colliding with a wall at Muan International Airport in the south west of the country.The plane, which was returning from Bangkok, in Thailand, was carrying 181 people - 179 of whom have died, while two crew members were rescued from the wreckage.Authorities are investigating the cause of the crash, which fire officials have indicated may have occurred due to a bird strike and bad weather. However experts have warned the crash could have been caused by a number of factors.', 'The flight, 7C2216, was a Boeing 737-800 operated by Jeju Air, Korea\'s most popular budget airline.The plane arrived in Muan at about 09:00 local time (00:00 GMT).A South Korean transport official said that the plane had been attempting to land but was forced to hold off after air traffic control gave a bird strike warning - an alert about the risk of a collision with birds.About two minutes later, the pilot called in a Mayday and air traffic command gave permission for the plane to land from the opposite direction, the official said.One video appears to show the plane touching down without using its wheels or any other landing gear. It skidded down the runway and crashed into a wall before erupting into flames.A witness told the South Korean news agency Yonhap that they heard a ""loud bang"" followed by a ""series of explosions"".Videos from the scene show the plane ablaze with smoke billowing into the sky. Fire crews have since extinguished the fire.', 'Lee Jeong-hyun, the chief of the Muan fire department, told a televised briefing that the tail section of the plane was identifiable but ""one cannot recognise the shape of the rest of the plane"".He said that the bird strike and bad weather may have caused the crash - but that the exact cause is still being investigated. The flight and voice recorders from the plane have been recovered, though the Yonhap news agency reported that the former was damagedOne passenger on the flight messaged a relative, saying that a bird ""was stuck in the wing"" and that the plane could not land, local media reported.Officials, however, have not confirmed whether the plane did actually collide with any birds. The head of Jeju Air\'s management said that the crash was not due to ""any maintenance issues"", Yonhap reported.The South Korean transport department said that the head pilot on the flight had held the role since 2019 and had more than 6,800 hours of flight experience.Geoffrey Thomas, an aviation expert and editor of Airline News, told the BBC that South Korea and its airlines were considered ""industry best practice"" and that both the aircraft and the airline have an ""excellent safety record"".He added: ""A lot of things about this tragedy don\'t make sense.""', 'A bird strike is a collision between a plane in flight and a bird. They are very common - in the UK, there were more than 1,400 bird strikes reported in 2022, only about 100 of which affected the plane, according to data from the Civil Aviation Authority.The best known bird strike occurred in 2009, when an Airbus plane made an emergency landing on New York\'s Hudson River after colliding with a flock of geese. All 155 passengers and crew survived.Professor Doug Drury, who teaches aviation at CQUniversity Australia, wrote in an article for The Conversation this summer that Boeing planes have turbofan engines, which can be severely damaged in a bird strike. He said that pilots are trained to be especially vigilant during the early morning or at sunset, when birds are most active.But some aviation experts are sceptical about whether a bird strike could have caused the crash at Muan Airport.""Typically they [bird strike] don\'t cause the loss of an airplane by themselves,"" Mr Thomas told Reuters. Australian airline safety expert Geoffrey Dell also told the news agency: ""I\'ve never seen a bird strike prevent the landing gear from being extended.""', ""The plane was carrying 175 passengers and six crew. Two of the passengers were Thai and the rest are believed to have been South Korean, authorities have said. Many are thought to have been returning from a Christmas holiday in Thailand.The official death toll stands at 179 - making it the deadliest plane crash in South Korean history. All the passengers and four members of crew died.Authorities have so far identified at least 88 bodies.Five of the people who died were children under the age of 10. The youngest passenger was a three-year-old boy and the oldest was 78, authorities said, citing the passenger manifest.South Korea's National Fire Agency said two members of flight crew - a man and a woman - survived the crash. They were found in the tail side of the aircraft after the crash and taken to hospital, it said.More than 1,500 emergency personnel have been deployed as part of recovery efforts, including 490 fire employees and 455 police officers. They have been searching the area around the runway for parts of the plane and those who were onboard."", 'Acting President Choi Sang-mok has declared a special disaster zone in Muan, which makes central government funding available to the local government and victims.All flights to and from Muan International Airport have been cancelled.Families of the victims of the crash have been travelling to the airport in the hope of finding out what happened to their relatives. Video footage from Reuters shows officials reading names of the victims out loud.', ""Airport authorities and the Red Cross have set up more than a dozen tents in the airport for bereaved families to grieve in private. Sounds of crying echoed through the terminal. Some are frustrated at how long it is taking to identify the bodies.Jeju Air has apologised to families. Its chief executive said in a news conference that the airline had no history of accidents. It is believed that Sunday's crash has been the only fatal accident since the airline was launched in 2005."", 'Plane manufacturer Boeing has offered condolences to those affected.Choi, South Korea\'s acting president, said: ""I express my deepest condolences to the many victims in the incident. I will do all I can for the injured to quickly recover.""The government has declared a period of national mourning for the country for the next seven days, during which flags at government offices will be lowered.']"
179 people killed in deadliest plane crash in South Korea,4 hours ago,Frances Mao,,"[""All passengers and most of the crew on board a Jeju Air flight have died after the plane crash-landed at an airport in South Korea on Sunday.A total of 179 of the 181 people on board the Boeing 737-800 were killed, with just two survivors, both cabin staff, pulled from the burning wreckage.The plane landed at Muan International Airport in the country's south, skidding off the runway and crashing into a wall in a fiery explosion.Flight 2216 was returning from Bangkok, Thailand with six crew and 175 passengers, many of them holidaymakers.Distraught families gathered in the airport's arrival hall in tears, as they waited for bodies to be identified."", 'Some of those killed have only been identifiable by their fingerprints. Maeng Gi-su, 78, told the BBC his nephew and his nephew\'s two sons had been on the plane. It was the family\'s first trip abroad, to mark the youngest son finishing his college entrance exams.""I can\'t believe the entire family has just disappeared. My heart aches so much,"" he said.The passengers included 173 South Koreans and two Thai nationals. They were aged between 3 and 78, although most were in their 40s, 50s and 60s, South Korea\'s Yonhap News Agency reported.', ""Footage shared of the crash - which happened shortly after 09:00 local time (00:00 GMT) - showed the aircraft landing without wheels, overshooting the runway and crashing into the airport's perimeter wall, before it exploded into flames.An investigation into the cause is under way. There had been no initial reports of plane or maintenance problems at take-off.  South Korean transport officials are reporting the plane ran into difficulties approaching landing - with the pilot, who had more than 6,800 hours of flight experience - pulling out of the first attempt due to bird interference.Soon after, the pilot issued a mayday call and made the ill-fated emergency landing attempt. A malfunction with the landing gear may have arisen from birds getting caught in the plane's systems, local media reported.One passenger sent a relative a message saying a bird was stuck in the wing, the South Korean News1 agency said."", 'The disaster is a national tragedy for South Korea, which has been embroiled in a political crisis after President Yoon and his temporary successor were both impeached by parliament.Acting President Choi Sang-mok, who was only appointed on Friday, visited the site of the crash on Sunday. ""I express my deepest condolences to the many victims in the incident. I will do all I can for the injured to quickly recover,"" Choi said.South Korea\'s airlines have typically been seen as ""industry best practice"" with good safety records, analysts have said.The Jeju Air crash is the worst for any South Korean airline since the 1997 Korean Air crash in Guam, which killed more than 200 people. Prior to Sunday, the deadliest on South Korean soil was an Air China crash flight that killed 129.The Muan airport crash also marks the first fatal accident for Jeju Air, one of South Korea\'s largest low-cost airlines which was set up in 2005.Jeju Air bosses bowed deeply as they gave a public apology at a press conference on Sunday.""We deeply apologise to all those affected by the incident. We will make every effort to resolve the situation,"" the firm said in a statement.Boeing Airlines, which manufactured the 737-800 jet, has said it is in touch with the airline.']"
Prison officer arrested after reports of sex video,2 days ago,Sean Dilley,"BBC News, Northamptonshire","['A female prison officer has been suspended after being arrested on suspicion of misconduct in public office.It follows reports in The Sun that a custody officer was detained after a video of her having sex with a male inmate was shared with prisoners at HMP Five Wells in Wellingborough, Northamptonshire.The BBC has not been able to verify the nature of the allegations but can confirm she is aged 19 and was suspended from her job at the privately-run prison on 23 December, following her arrest by Northamptonshire Police.""A prison custody officer has been suspended and arrested by Northamptonshire Police on suspicion of misconduct in a public office,"" a spokesperson for HMP Five Wells said.', 'Both the prison and police said they were unable to comment further.', 'Follow Northamptonshire news on BBC Sounds, Facebook, Instagram and X.']"
Lost city found by accident and a fly's brain mapped: 2024's scientific wins,,BBC News,Member of BBC News. Name not available,"[""A total solar eclipse seen by millions, a lost jungle city discovered by accident and hope for the almost extinct northern white rhino - science has given us a lot to get excited about this year.One of the biggest news stories was about making space travel cheaper and easier, with Elon Musk's Starship making a giant step towards humanity having a reusable rocket.Of course it's not all been positive. In bad news for the planet, for example, it is now virtually certain that 2024 will be the world's warmest year on record.But there has been a lot to celebrate. Here are seven of our favourite uplifting science stories of the year."", 'In October, Elon Musk\'s Starship rocket completed a world first after part of it was captured on its return to the launch pad.The SpaceX vehicle\'s lower booster rocket flew back to its launch tower, instead of falling into the sea. It was caught in a giant pair of mechanical arms, or ""chopsticks"" as part of its fifth test flight.It brought SpaceX\'s ambition of developing a fully reusable and rapidly deployable rocket to go to the Moon and maybe even Mars a big step closer.""A day for the history books,"" engineers at SpaceX declared as the booster landed safely.You can read more about the \'chopsticks\' moment here.', 'They can walk, hover and the males can even sing love songs to woo mates - all this with a brain that\'s tinier than a pinhead.But it wasn\'t until October that scientists studying the brain of a fruit fly mapped the position, shape and connections of every single one of its 130,000 cells and 50 million connections.It was the most detailed analysis of the brain of an adult animal ever produced, and one leading brain specialist described the breakthrough as a ""huge leap"" in our understanding of our own brains.One of the research leaders said it would shed new light into ""the mechanism of thought"". Read more about the story here.', 'Imagine you\'ve Googled something, you get to page 16 of the results and: ""Hold on, is that a lost Mayan city?""Well that\'s what happened to Luke Auld-Thomas, a PhD student at Tulane University in the US, who came across a laser survey done by a Mexican organisation for environmental monitoring.When he processed the data with methods used by archaeologists, he saw what others had missed - a huge ancient city which may have been home to 30-50,000 people at its peak from 750 to 850 AD.', 'In the city, which had disappeared under jungle canopy in Mexico, archaeologists found pyramids, sports fields and amphitheatres.The complex - which researchers named Valeriana - was revealed using Lidar, a type of laser survey that maps structures buried under vegetation.', ""There are only two northern white rhinos left in the world, but we reported on a fertility breakthrough that offered hope for saving the species.Scientists achieved the world's first IVF rhino pregnancy, successfully transferring a lab-created rhino embryo into a surrogate mother.The procedure was carried out with southern white rhinos, a closely related sub-species of northern whites which still number in the thousands, and took 13 attempts to accomplish.The mother eventually died of an infection, but a post-mortem revealed that the 6.5cm male foetus was developing well and had a 95% chance of being born alive, showing that a viable pregnancy through rhino IVF is possible.There are 30 precious northern white rhino embryos in existence. The next step would be repeating the success with some of these embryos."", 'With human activity driving what conservation charity the World Wide Fund for Nature (WWF) calls a ""catastrophic"" loss of species, it can sometimes feel like we don\'t hear an awful lot of good news about nature.But a ten-year study showed conservation actions are effective at reducing global biodiversity loss.Scientists from dozens of research institutes reviewed 665 trials of conservation measures in different countries and oceans, and found they had had a positive effect in two out of every three cases.The measures ranged from hatching Chinook salmon to the eradication of invasive algae, and the study\'s authors said their findings offered a ""ray of light"" for those working to protect threatened animals and plants.Read more about the story here.', 'Tens of millions of people across Mexico, the US and Canada had their heads turned, literally by a total solar eclipse.This is where the Moon moves between the Earth and the Sun, extinguishing its light.A total solar eclipse occurs somewhere on Earth roughly every 18 months, but they are often in quite unpopulated areas, whereas this one had major cities including Dallas in its path. The path of totality - the area where people could see the Moon totally block the Sun - was also much wider this year than it was during the spectacular total solar eclipse of 2017.For more on the story read here.', 'Millions once visited Sycamore Gap, the famous sycamore tree nestled in a gap in Hadrian\'s Wall.So when it was cut down in 2023, naturally a national outpouring of shock and dismay followed.But in March, new life sprung from the tree\'s rescued seeds and twigs, giving hope that the iconic tree has a future.BBC News saw the new shoots on a rare visit to the secret National Trust centre protecting the seedlings.Young twigs and seeds thrown to the ground when the tree toppled were salvaged by the National Trust, which cares for the site with the Northumberland National Park Authority.The saplings are now being given to charities, groups and individuals as ""trees of hope"".']"
Rebel Wilson marries Ramona Agruma in Sydney ceremony,5 hours ago,Monica Rimmer,BBC News,"[""Australian actor and comedian Rebel Wilson has legally married Ramona Agruma in Sydney, the star has announced on social media.The couple had a wedding ceremony in Sardinia in September but have since married again in a service officiated by Wilson's sister.The actress proposed to Agruma, a fashion and jewellery designer, at Disneyland in 2023.Among well-wishers commenting on social media were Pitch Perfect co-stars Adam Devine and Elizabeth Banks, who offered their congratulations to the couple."", 'Wilson, 44, said it felt ""right"" to have the wedding in her hometown. ""It meant my 94-year-old grandmother Gar could come which was very special to us to have her included,"" she wrote on Instagram. Agruma also shared photos from the day adding: ""Married officially in Australia to my Australian princess.""The couple are pictured beaming with the famous Sydney Harbour Bridge serving as the backdrop.The Bridesmaids actress announced the birth of her first child via surrogate in November 2022. Sharing a picture of daughter Royce Lilly, she described her as a ""beautiful miracle"".', 'The star made headlines earlier this year when the US version of her memoir, Rebel Rising, about Wilson\'s sexuality, weight and fertility, was released, and made allegations against Borat star Sacha Baron Cohen.The British edition of the book, published on 25 April, blacked out text believed to be relating to him. A spokesman for Baron Cohen at the time said the redactions represented a ""clear victory"", and reiterated his position that Wilson\'s claims were ""demonstrably false"".In her memoir, Wilson also talked about being a ""late bloomer"" and losing her virginity at 35.']"
