Title,Time,Publisher,Role,Descriptions
"From Squid Game to Blackpink, how South Korea became a culture powerhouse",,BBC News,Member of BBC News. Name not available,"[""Evan Barringer was 14 years old when he stumbled onto Full House, a South Korea romcom where two strangers are forced to share a house.Sitting in his house in Memphis, he hit play assuming it was an Asian remake of a beloved American sitcom from the 1980s. It wasn’t until the third episode that he realised they had nothing in common save the name. But he was hooked.That accidental choice changed his life. Twelve years on, he is an English teacher in South Korea - and he says he loves it here: “I have got to try all the foods I’ve seen in K-dramas, and I’ve gotten to see several of the K-pop artists in concerts whose lyrics I used to study Korean.”When Evan discovered Full House in 2012, South Korean entertainment was a blip in the world’s eye. Psy’s Gangnam Style was the best-known Korean pop export at the time. Today, there are more than an estimated 220 million fans of Korean entertainment around the world – that’s four times the population of South Korea. Squid Game, Netflix's most popular show ever, has just returned for a much-anticipated second season. How did we get here? The so-called Korean Wave swept the world, experts say, when the success of streaming met American-inspired production value. And Korean entertainment – from pop music and mushy dramas to acclaimed hits built around universal themes – was ready for it."", 'BTS and Blackpink are now familiar names on the global pop circuit. People are swooning over sappy K-dramas from Dubai to India to Singapore. Overseas sales of all this Korean content - including video games - is now worth billions.Last month, after 53-year-old poet and novelist Han Kang won the Nobel Prize for her literature, online boards were full of memes noting South Korea’s “Culture Victory” — a reference to the popular video game series Civilisation.And there were jokes about how the country had achieved the dream of founding father Kim Koo, who famously wrote that he wished for Korea to be a nation of culture rather than might.As it turns out, this moment had been in the making for years.', 'After South Korea’s military dictatorship ended in 1987, censorship was loosened and numerous TV channels launched. Soon, there was a generation of creators who had grown up idolising Hollywood and hip-hop, says Hye Seung Chung, associate professor of Korean Film Studies at the University of Buffalo.Around the same time, South Korea rapidly grew rich, benefitting from an export boom in cars and electronics. And money from conglomerates, or chaebols as they are known, flowed into film and TV production, giving it a Hollywood-like sheen.They came to own much of the industry, from production to cinemas. So they were willing to splurge on making movies without worrying much about losses, Prof Chung says.', 'K-pop, meanwhile, had become a domestic rage in the mid-90s, propelling the success of groups such as HOT and Shinhwa.This inspired agencies to replicate the gruelling Japanese artist management system.Scout young talent, often in their teens, and sign them onto years-long contracts through which they become “perfect” idols, with squeaky clean images and hyper-managed public personas. As the system took hold, it transformed K-pop, creating more and more idols.By the 2000s, Korean TV shows and K-pop were a hit in East and South East Asia. But it was streaming that took them to the world, and into the lives of anyone with a smartphone.That’s when the recommendation engine took over – it has been key in initiating Korean culture fans, taking them from one show to the next, spanning different genres and even platforms.', 'Evan says he binged the 16 hour-long episodes of Full House. He loved the way it took its time to build the romance, from bickering banter to attraction, unlike the American shows he knew.“I was fascinated by each cultural difference I saw - I noticed that they don’t wear shoes in the house,” he recalls. So he took up Netflix’s suggestions for more Korean romcoms. Soon, he found himself humming to the soundtracks of the shows, and was drawn to K-pop.He has now begun watching variety shows, a reality TV genre where comedians go through a series of challenges together.', 'As they work their way through the recommendations, fans are immersed in a world that feels foreign yet familiar – one that eventually includes kimchi jiggae, a spicy kimchi stew, and kalguksu, a seafood and kelp noodle broth.When Mary Gedda first visited South Korea, she went looking for a bowl of kimchi jjigae, as she had seen the stars do on screen numerous times.“I was crying [as I ate it]. It was so spicy,” she says. “I thought, why did I order this? They eat it so easily in every show.”Mary, an aspiring French actor, now lives in Seoul. Originally a K-pop fan, she then discovered K-dramas and learned Korean. She has starred in a few cameo roles as well. “I got lucky and I absolutely love it,” she says.For Mary, food was a big part of the appeal because she saw such a variety of it on K-dramas. Seeing how characters build relationships over food was familiar to her, she says, because she grew up in the French countryside in Burgundy.', 'But there is also the promise of romance, which drew Marie Namur to South Korea from her native Belgium. She began watching K-dramas on a whim, after visiting South Korea, but she says she kept going because she was “pretty much attracted to all those beautiful Korean men”.""[They] are impossible love stories between a super-rich guy and a girl who is usually poor, and, you know, the guy is there to save her and it really sells you a dream.""But it is Korean women who are writing most of these shows – so it is their imagination, or fantasy, that is capturing the interest (and hearts) of other women across the world.In Seoul, Marie said she was “treated like a lady”, which hadn’t happened “in a very long time”, but her “dating experience is not exactly as I expected it to be”.“I do not want to be a housewife. I want to keep working. I want to be free. I want to go clubbing with my girlfriends if I want to, even though I\'m married or in a relationship, and a lot of guys here do not want that.”', 'International fans are often looking for an alternative world because of disappointment with their own society, Prof Chung says.The prim romances, with handsome, caring and chivalrous heroes, are drawing a female audience turning away from what they see as hypersexual American entertainment. And when social inequality became a stronger theme in Korean films and shows - such as Parasite and Squid Game – it attracted global viewers disillusioned with capitalism and a yawning wealth divide in their countries.', ""The pursuit of a global audience has brought challenges as well. The increasing use of English lyrics in K-pop has led to some criticism. And there is now a bigger spotlight on the industry's less glamorous side. The immense pressure stars face to be perfect, for instance, and the demands of a hyper-competitive industry. Creators behind blockbuster shows have alleged exploitation and complained about not being fairly compensated. Still, it’s great to see the world pay attention to Korea, Prof Chung says. She grew up in a repressive South Korea, when critics of the government were regularly threatened or even killed. She escaped into American movies.When Parasite played in the cinema of the small American town where she lives, she saw on the faces of other moviegoers the same awe she felt as a child watching Hollywood films: “It feels so great that our love is returned.”""]"
"UK and EU look to 2025 for reset, but with little room for trade-offs",15 hours ago,Katya Adler,Europe Editor,"[""Early in 2025, Prime Minister Sir Keir Starmer has been invited to an informal summit of EU leaders. It's the first such invitation for the UK since the bitter days of the Brexit negotiations.The focus of the February meeting is future security and defence co-operation. The backdrop: the volatile state of the world from Europe's perspective. Wars rage in the Middle East and in Europe - with Russia aided in its assault on Ukraine by Iran, North Korea and China.Adding to the uncertainty haunting this continent, Donald Trump is poised to re-enter the White House. He threatens Western cohesion with his pledge to slap punitive tariffs on imports - a big worry to the EU and the UK - and to potentially walk away from Nato, the transatlantic defence alliance Europeans have relied on for security, since its founding after World War Two."", 'These threats to security and to trade revenues have helped remind the EU and the UK of the common values they share in unpredictable times. The EU felt weakened by Brexit in 2016. It meant losing a big economy and its only significant military power apart from France. As for post-Brexit UK, now free from the rules of EU membership, it\'s also now a far smaller power on the world stage. And, closer to home, the Labour government has realised Europe is key to delivering on a number of priority pledges to the UK public.""The economy, defence, migration... there\'s a European element to all of this, making EU relations important for the whole government agenda. Things which will make a success of this government are tied up with Europe,"" says Mark Leonard, the director of the European Council on Foreign Relations.Labour has repeatedly promised an ""ambitious reset"" of EU-UK relations. There has been lots of shuttle diplomacy and symbolism since it won the general election in the summer.Foreign Secretary David Lammy attended a meeting of EU Foreign Ministers, Chancellor Rachel Reeves gave a speech at a summit of EU finance ministers, and the prime minister popped over to Brussels for a sit-down with EU Commission Chief Ursula von der Leyen.', 'But what does this ""reset"" really mean? What can we expect in 2025? Might the UK government allow some freedom of movement in exchange for economic benefits on EU trade?An EU-UK summit is planned for spring, and a number of political figures and high-level diplomats from EU member states and the UK spoke to me on condition of anonymity ahead of bilateral negotiations getting started.I kept hearing of the ""enormous amount of goodwill"" in the EU towards the new Labour government with its oft-repeated ""reset"" enthusiasm. At the same time though, there is a clear note of Brussels scepticism the Labour government would do well to take heed of, if it wants to see tangible results.""The headspace is there. The appetite is there in Europe for closer UK relations,"" one EU figure told me. ""What\'s less clear is what London is really interested in - and what trade-offs it\'s willing to make to get there. That\'s key and that appears not to have been bottomed out in London yet.""', 'The defence and security arrangement I have mentioned is the proverbial ""low-hanging fruit"" as far as an EU-UK reset is concerned.It\'s relatively easy to formalise what is already happening: co-operation over Russia sanctions for example, as well as discussions - already taking place inside Nato - over military and defence capabilities and how to best protect Europe against cyber-attacks and attacks on key installations like energy infrastructure in the North Sea. It\'s seen as a win-win agreement. And there is no proposal to make a defence pact legally binding. The Labour government does not have to worry here about being seen - by the political opposition or those in the UK who voted Leave - as attempting to ""roll back Brexit"".  And it is sensitive about this potential accusation.But Labour has also made promises on trade and the economy: to ""make Brexit work"" and to ""tear down"" the trade barriers hard Brexit imposed. The Office for Budget Responsibility reckons Brexit will cost the UK economy 4% of GDP in the long term. Labour wants to avoid that, but that\'s not as straightforward as it might sound.', 'EU figures say they\'re confused by the UK government proclaiming an ""ambitious"" reset while insisting on maintaining restrictive post-Brexit red lines.A recent working paper setting out EU interests noted there were ""limited economic gains on offer"" because of the UK ruling out rejoining the EU\'s customs union or single market or accepting the free movement of people.Some in the EU suspect the UK government believes it can get a quid pro quo on trade for defence. That they say, is never going to happen.""The UK is mistaken if it thinks it can use an agreement on defence as a backdoor to getting sweet deals with us on trade,"" an EU diplomat told me.""For us, it\'s like being in a weird tug of war. With the devil on one EU shoulder and an angel on the other. In terms of values, there is more that unites us than divides us with the UK. ""The EU wants to take action to get the UK closer, but on the other hand, we can\'t do away with technical minutiae that are the foundation of the EU. We can\'t make special deals, even if that limits the relationship with the UK.""In order to see significant improvement in economic relations, both sides will have to make compromises.In Brussels, there is no appetite to rip up the TCA - the already-existing trade agreement between the EU and UK. But you do detect an EU openness to starting negotiations on different economic sectors simultaneously. ""We can walk and chew gum at the same time,"" insisted one EU diplomat.There\'s also an acknowledgement on the UK side that sectoral agreements might well have to involve aligning with EU rules in those sectors.', 'The key to any compromise that Labour might make with the EU going forward will be: Can they sell the result back home as a win for the British public?The EU will push hard for long term fishing rights in UK waters.It also wants a Youth Mobility Scheme, allowing 18-30 year olds to work and/or study in the UK or the EU for up to three years, paying local fees at university if they choose the study option.The UK government insists there will be no return to freedom of movement with the EU. Migration is a hot button issue. But it\'s notable that Labour has not explicitly ruled out the youth scheme. They\'ve only said they\'ve ""no plans"" to go for it.On youth mobility, the assumption is that more EU youngsters would take advantage of a mobility scheme than UK citizens because of language barriers.', 'But the UK government might use openness to the EU-requested mobility scheme and/or a fishing agreement as leverage to negotiate something important for UK interests, such as the mutual recognition of professional qualifications, which eases cross-Channel business, or the mobility of UK artists and entertainers to travel in the EU. Both of these were listed in the Labour election manifesto as priorities if the party got into government.Labour also wants to move on a veterinary agreement with the EU, to reduce barriers in the trade of food and agricultural products. That would require UK alignment with EU animal and plant health rules.', ""The EU and UK are both interested in better co-operation and coordination on energy and climate. Sir Keir also labelled this a priority.Linking carbon emissions trading schemes, as the EU does with a number of other countries, would mean the UK avoiding EU carbon border adjustment mechanism (CBAM) implications - a cost feared by UK businesses.And removing post-Brexit blockages on the electricity market would deliver €44bn (£36bn) in savings to EU and UK consumers by 2040 and reduce investment costs in North Sea wind by 16%, according to Baringa business consultancy.The North Sea basin comprises the UK plus EU member states Belgium, Denmark, Germany and the Netherlands and Single Market member Norway. It's one of the most promising regions in the world for offshore wind.On illegal migration, the EU says it's open to co-operating more closely with the UK. It wants the UK to crack down more on people working illegally in the country.  France complains that the ease with which it says irregular migrants can disappear and make a living is a major a pull-factor to the UK for economic migrants. The EU has ruled out the UK being able to send migrants, arriving illegally on its shores aboard small boats, back to the EU countries they set off from."", 'Whatever the developments in EU-UK relations in 2025 and beyond, they are likely to happen slowly because of political concerns and because negotiations have a habit of getting bogged down in detail.In direct contrast, a recent poll by YouGov and Datapraxis for the European Council of Foreign Relations suggests voters in the EU and UK are far more gung-ho than leaders in Brussels and London about jumping over previous political taboos to strengthen ties.The poll found that around half of those asked in the UK believe greater engagement with the EU is the best way to boost the UK economy (50%), strengthen its security (53%) and effectively manage migration (58%). When asked who the UK government should prioritise relations with, 50% choose Europe and only 17% the US. A huge 68% of respondents in Britain see a benefit in reintroducing cross-Channel freedom of movement in exchange for access to the European single market.The desire for co-operation, and willingness to forgo previous red lines, is also reciprocated in Europe. A majority of voters in Poland (54%) and Germany (53%) – and a prevailing opinion in Spain (43%), Italy (42%) and France (41%) – believe the EU should grant the UK special access to certain parts of the European single market to secure a closer security-based relationship.Geopolitical threats and uncertainties appear to be shifting public opinion dramatically. Will the political class in the UK and EU choose to keep up?']"
Growth of women in power grinds to near-halt in a mega-election year,15 hours ago,"Vibeke Venema, Stephanie Hegarty and Leoni Robertson",BBC 100 Women,"[""Nearly half the world's population - 3.6 billion people - had major elections in 2024, but it was also a year that saw the slowest rate of growth in female representation for 20 years.Twenty-seven new parliaments now have fewer women than they did before the elections - countries such as the US, Portugal, Pakistan, India, Indonesia and South Africa. And, for the first time in its history, fewer women were also elected to the European Parliament.The BBC has crunched numbers from 46 countries where election results have been confirmed and found that in nearly two-thirds of them the number of women elected fell.The data is from the Inter-Parliamentary Union (IPU) - a global organisation of national parliaments that collects and analyses election data."", 'There were gains for women in the UK, Mongolia, Jordan and the Dominican Republic, while Mexico and Namibia both elected their first female presidents.However, losses in other places mean that the growth this year has been negligible (0.03%) - after having doubled worldwide between 1995 and 2020.', 'Mariana Duarte Mutzenberg, who tracks gender statistics for the IPU, says progress has been ""too fragile"" in certain democracies. For example, the Pacific Island nation Tuvalu lost its only female member of parliament, and now has no women in government at all.', 'The Pacific Islands have the lowest proportion of female members of parliament in the world at 8%.Globally, women make up 27% of parliaments worldwide, and only 13 countries are close to 50%. Latin America and parts of Africa are currently leading when it comes to female representation.Some countries, says Ms Duarte Mutzenberg, are still making gains, largely thanks to gender quotas - Mongolia jumped from 10% to 25% female representation this year, after introducing a mandatory 30% candidate quota for women.On average, countries without quotas have elected 21% women, compared with 29% with quotas.For example, quotas - and political will - helped Mexico achieve gender parity in 2018, after former president Andrés Manuel López Obrador decided the parliament should be 50% women.', 'Political will could also be a game-changer when it comes to ministerial positions, says Julie Ballington from UN Women - which collects data on women heading government ministries.Cabinets have the power to impact society, yet still have the lowest female representation of all the political measures UN Women looks at, she says, with women usually restricted to certain ministerial roles such as overseeing human rights, equality, and social affairs - rather than finance or defence.This is ""a missed opportunity"", she says.', 'With so many different countries, contexts and political intricacies at play it is hard to define why the dial hardly shifted this year.But there are some universal barriers to women\'s participation in politics.Firstly, research has shown there is an ambition gender gap.""Women are less likely to wake up and think they would be good in senior leadership,"" professor of politics Rosie Campbell told an audience at King\'s College, London. ""They often need to be nudged: \'Have you thought about being an MP?\'""And a slow-down could mean fewer mentors for future female politicians, says Dr Rachel George, an expert on gender and politics at Stanford University in the US. So young women would be ""less likely to think that they can, or should, run"".Once they do decide to run for office, women tend to be at a disadvantage financially.A wealth of research has found it is harder for women to access funding for a political campaign or to have the financial freedom to take time off work.In most societies, women still have more caring responsibilities than men - which can negatively affect how they are viewed by voters, says Dr George.This is not helped by the fact that few parliaments offer maternity leave, says Carlien Scheele from the European Institute for Gender Equality (EIGE). ""It puts women off if those policies are not in place,"" she says.', 'And then, there is the way electoral systems are designed.Countries using proportional representation (PR) or mixed electoral systems elect a higher share of women than first-past-the-post systems and are also more likely to have electoral quotas for women, according to the IPU.But those factors are not new. So what is changing?There has been an increase in attacks on women in public life, online and in person, according to studies in many different countries. In Mexico, which already experiences violent elections, gender-based violence was particularly high this year, says IPU\'s Mariana Duarte Mutzenberg, with women politicians also particularly targeted by disinformation aimed at ""trying to ruin their reputation in one way or another"".This all has a wider ""chilling effect"" and stops younger women from wanting to run, says Dr George.', 'A backlash to female economic empowerment and feminism is also a factor.In South Korea - despite a small increase in the share of women elected - a feeling among many young men of reverse discrimination played out in this year\'s election.""Some parties continued to fuel or tap into an anti-gender sentiment among male voters who perceive women\'s rights advocates as anti-men,"" says Ms Duarte Mutzenberg.However, she says, this may have led to even more women coming out to vote.', 'So why does it all matter?Basic fairness aside, equal parliaments could improve national economies, says EIGE\'s Carlien Scheele, citing research showing gender diverse groups make better decisions, and gender-mixed boards lead to higher profits.Studies have also shown the benefits of including women in peace negotiations, suggesting that processes which are based on substantive contributions from women are more likely to achieve sustainable outcomes.""When women are in the room, peace deals are more likely to happen and more likely to last,"" says Dr George.Julie Ballington from UN Women says she would encourage people to think about women in politics differently.""It\'s not the under-representation of women. It\'s the over-representation of men.""', 'Additional data analysis by Rebecca Wedge-Roberts from BBC VerifyDesign by Raees Hussain']"
